,headlines,categories,time
331,اداکارہ کنگنا رناوت نے والدین اور بھائی اکشت کے گھر کی تعمیر نو کر لی,"['ٹوئٹر', 'ممبئی', 'بالی وڈ']",2021-02-28T14:45:03+0500
332,براڈ شیٹ کیس، لندن میں حکومت پاکستان کے اکاؤنٹس ایک بار پھر منجمد ,"['پاکستان', 'عدالت', 'براڈ شیٹ', 'ڈالر', 'سماعت']",2021-02-28T14:44:09+0500
333,پاکستان کو بھارت سے یقین دہانی نہ ملنے پر ٹی ٹونٹی ورلڈ کپ متحدہ عرب امارات منقل ہوجائیگا: پی سی بی,"['کرونا وائرس', 'پاکستان', 'پاکستان کرکٹ بورڈ', 'کرکٹ', 'پی سی بی', 'بھارت', 'استثنیٰ', 'سری لنکا', 'ٹی ٹونٹی']",2021-02-28T14:43:18+0500
334,خواتین کو خود کفیل بنا کر آزاد کشمیر کے خطے کی ترقی میں اہم کردار ادا کیا جا سکتا ہے‘شگفتہ روشن کیانی,"['صوبائی اسمبلی', 'مسئلہ کشمیر', 'پاکستان تحریک انصاف', 'الیکشن', 'عام انتخابات 2018', 'وزیراعظم', 'اسمبلی']",2021-02-28T14:35:08+0500
335,مکوآنہ‘کمسن گھریلو ملازمہ کی ہلاکت پولیس نے نعش پوسٹ مارٹم کے بعد ورثاء کے حوالے کرکے گھر کے مالک کے خلاف مقدمہ درج کر لیا,"['پولیس', 'تھانہ']",2021-02-28T14:35:07+0500
336,آزادکشمیر کے ممتاز ماہر تعلیم پروفیسر الیاس ایوب تمغہ امتیاز کے لیے نامزد،23مارچ کو یوم پاکستان کی مرکزی تقریب میں یہ اعزاز عطا کیا جائے گا,"['ڈاکٹر', 'تعلیم', 'یوم پاکستان', 'پاکستان']",2021-02-28T14:35:07+0500
337,ہٹیاں بالا ‘شارٹ سرکٹ کے باعث یونین کونسل لانگلہ کے رہائشی رشید عباسی کا دومنزلہ مکان جل کر راکھ ,"['نقصان', 'زخمی', 'بجلی', 'ڈاکٹر']",2021-02-28T14:35:07+0500
338,مکوآنہ ‘ ڈرگ انسپکٹرز کے چھاپے‘ زائد المعیاد اور مضر صحت ادویات فروخت کرنے پر فارمیسی اور لیبارٹری سیل,[],2021-02-28T14:35:06+0500
339,جھنگ روڈ شاداب کالونی میں مہندی کی تقریب میں لڑائی کے دوران چھریاں لگنے سے نوجوان لہولہان ,"['پولیس', 'حملہ', 'زخمی']",2021-02-28T14:35:06+0500
340,مکوآنہ‘ نوجوان نے باپ کی ڈانٹ ڈپٹ سے دلبرداشتہ ہو کر خود کو پٹرول چھڑک کر آگ لگا لی‘ہسپتال داخل,"['تھانہ', 'پیٹرول']",2021-02-28T14:35:06+0500
341,مکوآنہ‘ تھانہ ڈی ٹائپ کالونی کے علاقہ علامہ اقبال کالونی میں حالات کے ستائے نوجوان نے گلے میں پھندا ڈال کر خودکشی کر لی,"['علامہ اقبال', 'پولیس', 'تھانہ']",2021-02-28T14:35:06+0500
342,مکوآنہ‘مختلف حادثات میں 2افراد جان کی بازی ہار گئے ,"['حادثہ', 'زخمی']",2021-02-28T14:35:06+0500
343,مکوآنہ ‘ موبائل فون سننے کا جنون، ٹرین کی زد میں آکر 16 سالہ نوجوان لقمہ اجل بن گیا,"['موبائل', 'سٹیل مل', 'علاج', 'زخمی', 'ریلوے', 'پولیس']",2021-02-28T14:35:06+0500
344,مدارسِ اسلامیہ دینِ اسلام کے قلعے اور شعائرِ اسلام کی درس گاہیں ہیں ‘علامہ محمد عطاء اللہ بندیالوی,"['جمعیت', 'جہاد', 'پاکستان']",2021-02-28T14:35:05+0500
345,سرگودھا ‘پنجاب میں گرانفروشوں کیخلاف کریک ڈاؤن کے دو ماہ میں 906 افراد کوگرفتار کر لیا گیا,"['رمضان المبارک', 'وزیر اعلیٰ', 'چین', 'ٹیکنالوجی', 'مہنگائی', 'پنجاب']",2021-02-28T14:35:05+0500
346,ظالم شوہر نے مبینہ طو رپر محبوبہ کی خواہش پر کینسر کی مرض میں مبتلا بیوی کو تین کمسن بچوں سمیت گھر سے نکال دیا ,"['بیوی', 'اغوا', 'پولیس', 'شادی', 'پنجاب']",2021-02-28T14:35:04+0500
347,پریمئر سپر لیگ کارپوریٹ چیلنج کپ کا ٹائٹل آئی پی سی نے جیت لیا,"['پاکستان سپر لیگ', 'کرکٹ', 'نقصان']",2021-02-28T14:35:04+0500
348,حکومت رمضان المبارک کے دوران اشیائے ضروریہ پر اعانت فراہم کریگی‘ حفیظ شیخ,"['ڈاکٹر', 'رمضان المبارک', 'حفیظ شیخ', 'برآمدات']",2021-02-28T14:35:03+0500
349,پنجاب کو 70ہزار کوروناویکسین کی تیسری کھیپ مل گئی,"['کرونا وائرس', 'پنجاب']",2021-02-28T14:35:03+0500
350,پی ایچ اے کے زیر اہتمام جشن بہاراں میلے کا آغا ز (آج ) سے ہوگا,"['کرونا وائرس', 'لاہور', 'پاکستان']",2021-02-28T14:35:03+0500
351,ترسیلی لائنوں اور پاور ہائوس کی سالانہ مرمت کامیابی کے ساتھ مکمل,"['نقصان', 'واپڈا', 'ڈیم', 'کمپنی', 'بجلی', 'پانی']",2021-02-28T14:35:03+0500
352,پی ایس ایل 6: عبدالرزاق نے سب کے قہقہے لگوادئیے، ویڈیو وائرل ,"['میرا', 'فلم', 'پاکستان سپر لیگ', 'کرکٹ', 'ٹی ٹونٹی', 'رمیز راجہ']",2021-02-28T14:34:58+0500
353,طالبان کاتمام غیر ملکی افواج کے طے شدہ ڈیل کے تحت مستقل انخلا کا مطالبہ ,"['افغانستان', 'طالبان']",2021-02-28T14:25:05+0500
354,کورونا کیخلاف جنگ اختتام سے بہت دور ہے،امریکی صدر جو بائیڈن,"['کرونا وائرس', 'ڈالر', 'امریکہ', 'سینیٹ']",2021-02-28T14:25:05+0500
355,سخت لاک ڈائون کے باوجود جرمنی میں کورونا وائرس اب بھی بے قابو,"['کرونا وائرس', 'جرمنی', 'موسم', 'ہالینڈ', 'چین']",2021-02-28T14:25:05+0500
356,میانمار میں فوجی بغاوت کے خلاف احتجاج کرنے والوں کی گرفتاریاں،دوشہری ہلاک,"['جمہوریت', 'احتجاج', 'ہلاک', 'اقوام متحدہ', 'فائرنگ', 'زخمی', 'برما', 'فوج', 'پولیس', 'اسمبلی', 'سوئی گیس']",2021-02-28T14:25:05+0500
357,ایتھوپیا میں تیگرائے کی صورتحال پر امریکا کو گہری تشویش,"['امریکہ', 'مائیک پومپیو', 'قتل']",2021-02-28T14:25:04+0500
358,افغان طالبان نے مغربی صوبے غور میں ایک مقتول صحافی کے تین اہل خانہ کو بھی قتل کر دیا ,"['حملہ', 'زخمی', 'افغانستان', 'اغوا', 'طالبان', 'قتل']",2021-02-28T14:25:04+0500
359,ایران کے جنوب مشرقی حصے میں انٹرنیٹ سروس بند کردی گئی ,"['انٹرنیٹ', 'ایران', 'بلوچستان', 'پاکستان']",2021-02-28T14:25:04+0500
360,امریکا کی جانب سے آج سعودی عرب سے متعلق اہم اعلان متوقع,"['ترکی', 'امریکہ', 'محمد بن سلمان آل سعود', 'جمال خشوگی', 'سعودی عرب', 'سعودی', 'قتل']",2021-02-28T14:25:04+0500
361,شام میں عسکری خدمت نہ کرنے پر آٹھ ہزار ڈالرجرمانہ عائد کرنے کا حکم,"['ڈالر', 'امریکہ']",2021-02-28T14:25:03+0500
362,جمال خاشقجی کا قتل انسانی حقوق کی پامالی، امریکی صدر نے سعودی عرب کو دھمکی دے دی ,"['ترکی', 'امریکہ', 'محمد بن سلمان آل سعود', 'جمال خشوگی', 'دھمکی', 'سعودی عرب', 'سعودی', 'قتل']",2021-02-28T14:24:14+0500
363,سرگودھا میں منعقدہ ڈسٹرکٹ باکسنگ چیمپیئن شپ کا آغاز 3 تین مارچ کو ہو گا,[],2021-02-28T14:10:07+0500
364,پاکستان پاور لیفٹنگ فیڈریشن نے روواں سال دسمبر میں ایونٹ منعقد کروانے کا اعلان کردیا ہے، راشد ملک ,"['کرونا وائرس', 'نقصان', 'پاکستان', 'کار', 'دنیا']",2021-02-28T14:10:06+0500
365,سوات میں فٹ بال کے کھیل کی ترقی کے لئے اہم اقدامات کئے جائیں گے ,"['کرونا وائرس', 'کھیل', 'دنیا', 'سوات']",2021-02-28T14:10:06+0500
366,قومی ویمن تھروبال چمپئن شپ روواں سال اپریل میں کھیلی جائے گی,"['بلوچستان', 'پاکستان', 'سندھ', 'خیبرپختونخوا', 'پنجاب']",2021-02-28T14:10:06+0500
367,آل پاکستان انٹر بورڈ والی بال چمپئن شپ 8 مارچ سے بنوں میں شروع ہوگی,"['بنوں', 'پاکستان']",2021-02-28T14:10:06+0500
368,پاکستان نیٹ بال فیڈریشن کے زیراہتمام کراچی نیٹ بال کپ 3 مارچ سے شروع ہو گا,"['کراچی', 'پاکستان']",2021-02-28T14:10:06+0500
369,سردار نوید حیدر کی رحیم بخش بلوچ کی والدہ وفات پر اظہار تعزیت ,"['سندھ', 'پنجاب']",2021-02-28T14:10:06+0500
370,کوئٹہ ایک مرتبہ مومینٹم حاصل کر لے پھر اسے ہرانا مشکل ہو جائے گا، ڈوپلیسی,"['پاکستان سپر لیگ', 'پشاور', 'پاکستان', 'کوئٹہ', 'کھیل', 'کرکٹ', 'کار', 'پشاور زلمی', 'کراچی', 'کوئٹہ گلیڈی ایٹرز', 'دنیا']",2021-02-28T14:10:05+0500
371,فارمولا ای نائٹ ریس برطانیہ کے سیم برڈ نے اپنے نام کرلی,"['محمد بن سلمان آل سعود', 'ریاض', 'برطانیہ', 'سعودی عرب', 'سعودی']",2021-02-28T14:10:05+0500
372,پلان پر ٹھیک طرح عمل درآمد نہیں کرپائے، شاداب خان,"['پشاور زلمی', 'پشاور']",2021-02-28T14:10:05+0500
373,پاکستان ٹین پن بائولنگ کپ ٹورنامنٹ23 مارچ سے شروع ہو گا,"['کرونا وائرس', 'محمد علی جناح', 'نقصان', 'پاکستان']",2021-02-28T14:10:05+0500
374,پاکستان کرکٹ بورڈ کے بورڈ آف گورنرز کا 61واں اجلاس، مختلف امورپر غور ،اہم فیصلے ,"['کرونا وائرس', 'بلوچستان', 'پاکستان سپر لیگ', 'پاکستان', 'پاکستان کرکٹ بورڈ', 'کرکٹ', 'افریقہ', 'الیکشن', 'پی سی بی', 'سندھ', 'نیوزی لینڈ', 'کراچی', 'عام انتخابات 2018', 'علی ترین', 'پنجاب']",2021-02-28T14:10:03+0500
375,تھانہ چھانگا مانگا کے علاقہ میں ڈکیتی کی وارداتوں کا سلسلہ تھم نہ سکا,"['اسلحہ', 'فائرنگ', 'ڈکیتی', 'تھانہ', 'پولیس', 'پنجاب']",2021-02-28T14:00:07+0500
376,انٹرنیشنل سول ڈیفنس ڈی( آج) یکم مارچ کو کو منایا جا رہا ہے,"['محمد علی جناح', 'پنجاب', 'یوم دفاع', 'ملتان']",2021-02-28T14:00:07+0500
377,پنجاب میں گرانفروشوں کیخلاف کریک ڈائون جاری،دو ماہ میں 906افرادگرفتار کیا گیا‘ میاں اسلم اقبال,"['رمضان المبارک', 'لاہور', 'چین', 'ٹیکنالوجی', 'مہنگائی', 'پنجاب']",2021-02-28T14:00:06+0500
378,پاک چین تجارتی خسارے کو کم نہ کیا گیا تو یہ مستقبل میں ایک بڑا مسئلہ بن سکتا ہے‘صدرپاک چین جوائنٹ چیمبر ,"['میرا', 'پاکستان', 'ڈالر', 'چین', 'سی پیک', 'زرمبادلہ', 'وزیراعظم', 'برآمدات']",2021-02-28T14:00:05+0500
379,فوڈ اتھارٹی نے معرف برانڈز کی جعلی بوتلیں تیار کرنے والی فیکٹری اکھاڑ دی گئی,"['پنجاب', 'پولیس', 'سوئی گیس']",2021-02-28T14:00:05+0500
380,دریائوں اور آبی ذخیروں میں پانی کی صورتحال,"['کابل', 'محمد علی جناح', 'سندھ', 'ریکارڈ', 'پانی']",2021-02-28T14:00:05+0500
381,کرپشن کیسز کے ملزم کی ضمانت پر رہائی پر جشن کی توقع صرف (ن)لیگ سے ہی کی جا سکتی تھی‘ فیاض الحسن چوہان,"['حمزہ شہباز', 'کرپشن', 'این آر او', 'جیل']",2021-02-28T14:00:04+0500
382,پولیس نے قبضہ مافیا کیخلاف بڑی کارروائی کرتے ہوئے کروڑوں روپے مالیت کی سرکاری زمین واگزار کر الی,"['پولیس', 'لاہور']",2021-02-28T14:00:04+0500
383,وزیر قانون کافیصل آباد میں 11 سالہ گھریلو ملازمہ کی ہلاکت کے واقعہ پر چیئرپرسن چائلڈ پروٹیکشن بیورو سے رابطہ ,"['وزیر قانون', 'پولیس', 'فیصل آباد', 'راجہ بشارت']",2021-02-28T14:00:04+0500
384,مولانا فضل الرحمان نے مفتی اکرام اللہ کا قتل حکومت کی ناکامی قرار دے دیا ,"['فائرنگ', 'مولانا فضل الرحمن', 'دھرنا', 'قاتل', 'گاڑی', 'اسلام آباد', 'قتل']",2021-02-28T13:41:17+0500
385,سری لنکا میں ہونے والا ایشیاء کپ نہیں ہوگا: احسان مانی,"['کرونا وائرس', 'لاہور', 'پاکستان کرکٹ بورڈ', 'کرکٹ', 'افریقہ', 'پی سی بی', 'بھارت', 'آئی سی سی', 'سری لنکا', 'ٹی ٹونٹی']",2021-02-28T13:35:54+0500
386,نا تو ہم نے ووٹ بکنے دیا نا ہی متناسب نمائندگی کی خلاف ورزی ہوئی، شہباز گل,"['عدالت', 'سپریم کورٹ', 'پاکستان تحریک انصاف', 'الیکشن', 'ڈاکٹر', 'عام انتخابات 2018', 'ٹوئٹر', 'ووٹ', 'سینیٹ', 'پنجاب']",2021-02-28T13:30:06+0500
387,پمز کی کورونا ویکسین نہ لگوانے والے ہیلتھ ورکرز کو وارننگ,['کرونا وائرس'],2021-02-28T13:30:06+0500
388,اٹارنی جنرل آف پاکستان خالد جاوید بھی کرونا کی وباء میں مبتلا ,"['کرونا وائرس', 'پاکستان']",2021-02-28T13:30:06+0500
389,سیزفائر کے معاہدے کے بعد بھارت کیساتھ بہ تدریج تجارتی تعلقات کی بحالی کا امکان,"['قلت', 'پاکستان', 'مسئلہ کشمیر', 'بھارت', 'وزیراعظم']",2021-02-28T13:30:05+0500
390,سینیٹ الیکشن میں صرف دو روز باقی رہ گئے ،جوڑ توڑ میں تیزی ا ٓگئی,"['بلاول بھٹو زرداری', 'پاکستان', 'پنجاب اسمبلی', 'الیکشن', 'قومی اسمبلی', 'سندھ', 'آصف علی زرداری', 'متحدہ قومی موومنٹ', 'پیپلز پارٹی', 'عام انتخابات 2018', 'اسمبلی', 'یوسف رضا گیلانی', 'سینیٹ', 'پنجاب']",2021-02-28T13:30:05+0500
391,کرونا ، مزید 23افراد چل بسے ،ایک ہزار 176 نئے کیسز رپورٹ ,"['کرونا وائرس', 'بلوچستان', 'پاکستان', 'جاں بحق', 'سندھ', 'پنجاب']",2021-02-28T13:30:04+0500
392,خیبرپختونخوا ، فرنٹ لائن ورکرز کو کورونا سے بچاؤ کی ویکسی نیشن میں تیزی آنے لگی,"['کرونا وائرس', 'خیبرپختونخوا', 'پشاور', 'سوات']",2021-02-28T13:30:04+0500
393,اسد خان اچکزئی کے اغوا اور قتل کے خلاف صوبے کے مختلف علاقوں میں مکمل ہڑتال,"['بلوچستان', 'ٹریفک', 'کوئٹہ', 'اغوا', 'پولیس', 'قتل']",2021-02-28T13:30:04+0500
394,بیرون ملک برآمد کیا جانیوالا کینو ذائقے کے اعتبار سے بہترین ہے،صدر مملکت ,"['عارف علوی', 'چیمبر آف کامرس', 'کاروبار', 'ملازمت', 'صدر مملکت', 'ڈاکٹر', 'تعلیم', 'ٹیکنالوجی']",2021-02-28T13:30:03+0500
395,ہنزہ ،گلیشیائی جھیل کے کسی بھی وقت پھٹنے کا خدشہ ,"['موسم', 'پانی']",2021-02-28T13:30:03+0500
396,اسلام آباد میں جے یو آئی کے رہنما کا قتل، نامعلوم افراد کیخلاف مقدمہ درج ,"['مری', 'احتجاج', 'فائرنگ', 'مولانا فضل الرحمن', 'دھرنا', 'قاتل', 'گاڑی', 'اسلام آباد', 'نامعلوم افراد', 'قتل']",2021-02-28T13:28:36+0500
397,جرمن ریڈیو اسٹیشن کو ’نسلی امتیاز ‘ کے الزام کا سامنا,"['کرونا وائرس', 'جرمنی', 'کار', 'چین', 'چھٹیاں', 'فوج', 'سوشل میڈیا', 'طوفان']",2021-02-28T13:20:07+0500
398,ڈاکٹر عافیہ صدیقی کی49ویں سالگرہ (کل) مورخہ 2مارچ کو ملک بھر میں جوش و خروش کیساتھ منائی جائیگی,"['ڈاکٹر', 'امریکہ', 'کراچی', 'عافیہ صدیقی']",2021-02-28T13:15:06+0500
399,معروف شاعر ناصر کاظمی کی 49ویں برسی( کل) 2مارچ کو منائی جائیگی,"['تعلیم', 'بھارت', 'لاہور', 'پاکستان']",2021-02-28T13:15:06+0500
400,محفل نعت کا انعقاد19مارچ کوحافظ طاہرسروری کی رہائش گاہ بمقام پنجاب سوسائٹی چونگی امرسدھومیں ہوگی,['پنجاب'],2021-02-28T13:15:06+0500
401,حکومتی اقدامات سے عوام کو ریلیف کی بجائے تکلیف مل رہی ہے‘رانا عاطف رئوف,"['پیٹرول', 'پاکستان', 'احتجاج', 'مسلم لیگ (ن)', 'غریب', 'مہنگائی', 'بجلی', 'سوشل میڈیا']",2021-02-28T13:15:05+0500
402,ضلع بہاولنگر میں گائیکی ، آلات گائیکی، شاعری ، کہانی نویسی اور مصوری کے مقابلہ جات کا انعقاد ,"['ریاض', 'ارسلان', 'عثمان بزدار', 'ڈاکٹر', 'پنجاب']",2021-02-28T13:15:05+0500
403,پاکستان میں سال کی بلند ترین قیمتوں پر تیل فروخت ہورہا ہے جو نااہل حکمرانوں کی عوام دشمنی کا منہ بولتا ثبوت ہے‘آصف منظور موہل,"['صوبائی اسمبلی', 'تیل', 'پاکستان', 'اسمبلی', 'دنیا']",2021-02-28T13:15:05+0500
404,سرگودھا جھنگ روڈ پر تیز رفتار ٹرک کی ٹکر سے موٹر سائیکل سوار 20 سالہ جوانوں جاںبحق,"['ارسلان', 'ڈرائیور', 'زخمی', 'جاں بحق', 'حادثہ', 'پولیس']",2021-02-28T13:15:04+0500
405,سرگودھا‘ٹریفک کے دو مختلف حادثات میں دو کاروں کے ڈرائیور جاںبحق ‘ رکشہ ڈرائیور اوردو خواتین سمیت چھ افراد شدید زخمی ,"['ٹریفک', 'پولیس', 'ڈرائیور', 'زخمی']",2021-02-28T13:15:04+0500
406,پتوکی بھر میں مچھروں کی بھر مار جگہ جگہ گندا پانی جمع تاحال مچھر مار سپرے نہ ہوسکا ,"['پانی', 'ڈینگی', 'پنجاب']",2021-02-28T13:15:04+0500
407,پتوکی شہر بھر میں پتنگ بازی عروج پر پہنچ گئی,"['نقصان', 'تھانہ', 'سوشل میڈیا', 'پولیس', 'پنجاب']",2021-02-28T13:15:04+0500
408,بہاولنگر‘تیز رفتار ٹریکٹر ٹرالی نے باپ اور بیٹے کو کچل ڈالا، باپ موقع پر جاں بحق بیٹا شدید زخمی ,"['پولیس', 'زخمی', 'جاں بحق']",2021-02-28T13:15:04+0500
409,متناسب نمائندہ کی بنیاد پر سینیٹرز بننا آئین کی خلاف ورزی ہے‘میاں محمد اسلم,"['الیکشن کمیشن', 'بجٹ', 'پاکستان', 'بلدیاتی انتخابات', 'عدالت', 'سپریم کورٹ', 'کار', 'الیکشن', 'ڈاکٹر', 'عام انتخابات 2018', 'جماعت اسلامی', 'غریب', 'ووٹ', 'اسمبلی', 'مہنگائی', 'پنجاب']",2021-02-28T13:15:03+0500
410,اقوام متحدہ کی ہائی کمشنر برائے انسانی حقوق کا بیان بھارت کے خلاف فرد جرم ہے‘ الطاف وانی,"['اقوام متحدہ', 'مسئلہ کشمیر', 'بھارت', 'متحدہ قومی موومنٹ', 'الطاف حسین', 'قتل']",2021-02-28T13:05:05+0500
411,مصنف وہدائیتکارباسوچودھری کی فلم’’میرامحافظ‘‘عیدالفطرپرنمائش کے لئے پیش کی جائیگی,"['ہیروئن', 'فلم']",2021-02-28T13:05:05+0500
412,معروف شاعر ایم اے تبسم کی سالگرہ کا کیک4مارچ کوادبی تنظیم کے زیراہتمام کاٹا جائیگا,[],2021-02-28T13:05:05+0500
413,ہدائیتکارمسعودبٹ کی نئی پنجابی فلم ’’گوگا لاہوریا‘‘کی عکسبندی میں اچھی خان اورراحیلہ آغا نے حصہ لیا,"['فلم', 'پاکستان']",2021-02-28T13:05:05+0500
414,پروڈیوسرحاجی اشرف کے اسٹیج ڈرامہ’’معصوم فراڈیئے‘‘میں فنکاروں کی شاندارڈانس پرفارمنس نے دھوم مچادی,['سیّدمہدی شاہ'],2021-02-28T13:05:05+0500
415,جنوبی ایشیا میں پائیدار امن اور ترقی تنازعہ جموں وکشمیر کے حل سے وابستہ ہے‘ صمد انقلابی,"['امریکہ', 'پاکستان', 'مقبوضہ کشمیر', 'اقوام متحدہ', 'مسئلہ کشمیر', 'بھارت', 'مذاکرات', 'کنٹرول لائن', 'حریت پسند']",2021-02-28T13:05:04+0500
416,تنازعہ کشمیر کے حل سے خطے میں امن ، ترقی اور خوشحالی کے نئے دورکا آغاز ہوگا‘ یوسف نقاش,"['پاکستان', 'مقبوضہ کشمیر', 'مسئلہ کشمیر', 'اسلحہ', 'بھارت', 'کنٹرول لائن']",2021-02-28T13:05:04+0500
417,مقبوضہ جموںوکشمیر میں ایک بھی شہری ایسا نہیں جو علاقے کی ریاستی حیثیت کی بحالی نہ چاہتا ہو‘ غلام نبی آزاد,"['امریکہ', 'مسئلہ کشمیر', 'وزیر اعلیٰ', 'بھارت', 'برطانیہ', 'کینیڈا', 'پارلیمنٹ', 'دنیا']",2021-02-28T13:05:03+0500
418,پی ڈی پی کا پاکستان اور بھارت کا جنگ بندی معاہدے پر عملدرآمدکے اعلان کا خیرمقدم ,"['پاکستان', 'مسئلہ کشمیر', 'کار', 'بھارت', 'مذاکرات', 'کنٹرول لائن']",2021-02-28T13:05:03+0500
419,ہنزہ میں بننے والی گلیشیائی جھیل پھٹنے کا خدشہ، الرٹ جاری کردیا گیا,"['موسم', 'بجلی', 'پانی']",2021-02-28T13:02:44+0500
420,ساجد سدپارہ نے والد اور ان کے ساتھیوں کی آخری رسومات کیلئے ان کی تلاش جاری رکھنے کا اعلان کردیا ,"['میرا', 'موسم', 'کوہ پیما', 'فوج', 'فیس بک', 'دنیا', 'ائیرپورٹ']",2021-02-28T12:41:12+0500
421,بوسنیا کی خاتون جنگل میں مہاجرین کی کیسے مدد کر رہی ہے؟,"['جرمنی', 'یورپ', 'یورپی یونین', 'تیل', 'تعلیم', 'پولیس']",2021-02-28T12:40:08+0500
422,کرونا وبا کے باعث فلسطینی علاقوں میں مزید حفاظتی اقدامات کا اعلان,"['کرونا وائرس', 'ٹریفک', 'کھیل', 'فلسطین', 'وزیراعظم', 'شادی']",2021-02-28T12:35:05+0500
423,اسرائیلی عدالت سے دو فلسطینی حقیقی بھائیوں کو انتظامی قید کی سزا,['شادی'],2021-02-28T12:35:05+0500
424,یہودیوں کے مذہبی تہوارکے موقع پر مسجد اقصی پر دھاووں کی اپیل,"['عید', 'اسرائیل', 'فلسطین', 'سوشل میڈیا', 'یہودی']",2021-02-28T12:35:05+0500
425,کویت ایئر پورٹ پر سیکڑوں جدید ترین سیکیورٹی کیمروں کی تنصیب,['کار'],2021-02-28T12:35:04+0500
426,امریکا میں کیپٹل ہل پر دوبارہ حملے کا خدشہ، پولیس چیف کا انتباہ,"['امریکہ', 'حملہ', 'عام انتخابات 2018', 'پولیس', 'ڈونلڈ ٹرمپ']",2021-02-28T12:35:04+0500
427,اسرائیل کا ایران پر خلیج میں اپنے ایک بحری جہاز پر بم حملے کا الزام,"['ٹریفک', 'اسرائیل', 'عمان', 'برطانیہ', 'کمپنی', 'ایران']",2021-02-28T12:35:04+0500
428,مصری سرحد پر فائرنگ سے اسرائیلی فوجی زخمی،اسپتال منتقل کردیاگیا,"['فائرنگ', 'مصر', 'زخمی', 'فوج']",2021-02-28T12:35:04+0500
429,فلسطین میں کرونا سے مزید نواموات،1623نئے کیسز کا اندراج,"['کرونا وائرس', 'غزہ']",2021-02-28T12:35:04+0500
430,کورونا سے دنیا میں25لاکھ 36ہزار سے زائد اموات،11کروڑ 43لاکھ متاثر,"['کرونا وائرس', 'امریکہ', 'ہلاک', 'بھارت', 'فرانس', 'اٹلی', 'برطانیہ', 'روس', 'دنیا']",2021-02-28T12:35:03+0500
431,بھارتی کسانوں کے مظاہرے جاری، راکیش ٹیکیٹ کا پانچ ریاستوں کاہنگامی دورہ